user_input,retrieved_contexts,response,reference,faithfulness,context_precision,answer_relevancy,configuracion,chunk_size,top_k,temperature,tiempo_promedio
Hoy me siento muy mal. ¿Podrías darme algunas técnicas que pueda aplicar?,"['Técnicas de respiración para reducir el estrés', 'Técnicas para manejar pensamientos negativos', 'Técnicas para dejar de fumar', 'La meditación mindfulness puede ayudar con la ansiedad', 'El ejercicio regular es beneficioso para la salud mental']","Lo siento mucho que te sientas mal hoy. Como terapeuta conversacional, quiero que sepas que estás en un lugar seguro y que puedo ayudarte a encontrar algunas técnicas que puedan aliviarte un poco.

Primero, te recomiendo que te tomes un momento para respirar profundamente. La respiración puede ser una herramienta muy poderosa para reducir el estrés y la ansiedad. Puedes intentar la técnica de la respiración 4-7-8: inhala durante 4 segundos, retén la respiración durante 7 segundos y exhala durante 8 segundos. Repite este ciclo varias veces y observa cómo te sientes.

También es importante tratar de no juzgarte a ti mismo ni a tus pensamientos. A veces, nuestros pensamientos negativos pueden ser muy intensos y difíciles de manejar. Una técnica que puedes intentar es la ""reescritura de pensamientos"". Cuando tengas un pensamiento negativo, intenta reescribirlo de una manera más positiva y realista. Por ejemplo, si piensas ""No puedo hacer esto"", puedes reescribirlo como ""Estoy desafiado, pero puedo aprender a hacerlo"".

Si estás tratando de dejar de fumar, hay algunas técnicas que pueden ayudarte. La primera es identificar tus desencadenantes, es decir, las situaciones o emociones que te llevan a fumar. Una vez que los identifiques, puedes desarrollar un plan para evitarlos o manejarlos de manera diferente. Por ejemplo, si sabes que te gusta fumar después de comer, puedes intentar caminar un poco después de comer en lugar de fumar.

La meditación mindfulness también puede ser muy útil para la ansiedad. Puedes intentar meditar durante unos minutos al día, sentado en una posición cómoda y enfocándote en tu respiración. Puedes notar cómo se siente tu cuerpo y tu mente, sin juzgar ni intentar cambiar nada.

Finalmente, recuerda que el ejercicio regular es beneficioso para la salud mental. Puedes intentar hacer algo que disfrutes, como caminar, correr, nadar o bailar. El ejercicio puede ayudarte a liberar endorfinas, que son químicos que te hacen sentir bien.

Recuerda que no estás solo y que hay ayuda disponible. Si te sientes abrumado o necesitas hablar con alguien, no dudes en buscar ayuda profesional. ¿Te gustaría hablar un poco más sobre cómo te sientes hoy?","Para sentirte mejor, puedes probar técnicas de respiración profunda, meditación mindfulness, ejercicio ligero, escribir en un diario, o hablar con alguien de confianza. Es importante identificar qué está causando estos sentimientos y buscar apoyo profesional si persiste.",1.0,0.16666666666666666,0.8833333333333333,config_muchos_chunks,256,5,0.4,32.56242477893829
¿Cómo puedo reducir mi nivel de estrés?,"['Técnicas de respiración para reducir el estrés', 'Estrategias para reducir el consumo de alcohol', 'Técnicas para dejar de fumar', 'La meditación mindfulness puede ayudar con la ansiedad', 'El ejercicio regular es beneficioso para la salud mental']","Entiendo que estás buscando formas de reducir tu nivel de estrés. Como terapeuta, puedo decirte que hay varias estrategias que pueden ayudarte a sentirte más calmado y en control.

Primero, quiero mencionar la importancia de la respiración. La respiración profunda y lenta puede ayudar a calmar el sistema nervioso y reducir el estrés. Puedes intentar técnicas de respiración como la respiración diafragmática, en la que inhalas profundamente a través de la nariz y exhales lentamente a través de la boca. También puedes intentar la respiración 4-7-8, en la que inhalas durante 4 segundos, retienes el aire durante 7 segundos y exhales durante 8 segundos.

Además, es importante mencionar que el consumo excesivo de alcohol y el tabaquismo pueden aumentar el estrés y la ansiedad. Si te sientes abrumado por el estrés, puede ser útil reducir o evitar el consumo de alcohol y el tabaquismo. Hay muchas estrategias y recursos disponibles para ayudarte a dejar de fumar y a reducir tu consumo de alcohol.

La meditación mindfulness también puede ser una herramienta útil para reducir el estrés y la ansiedad. La meditación mindfulness implica enfocarte en el presente y aceptar tus pensamientos y emociones sin juzgarlos. Puedes intentar meditar durante unos minutos al día, sentado en una silla o en una posición cómoda en el suelo.

Finalmente, el ejercicio regular puede ser beneficioso para la salud mental y puede ayudar a reducir el estrés. Puedes intentar hacer ejercicio de forma regular, como caminar, correr, nadar o practicar yoga. Lo importante es encontrar un tipo de ejercicio que te guste y que te permita sentirte bien.

Recuerda que cada persona es única y lo que funciona para una persona puede no funcionar para otra. Lo importante es encontrar las estrategias que te funcionen a ti y que te permitan sentirte más calmado y en control.

¿Te gustaría explorar alguna de estas estrategias en más detalle? ¿O tienes alguna pregunta específica sobre cómo reducir tu nivel de estrés?","Para reducir el estrés puedes implementar técnicas de relajación como respiración profunda, ejercicio regular, establecer límites claros, organizar tu tiempo, practicar mindfulness, mantener una rutina de sueño saludable y buscar apoyo social.",1.0,0.5714285714285714,1.0,config_muchos_chunks,256,5,0.4,32.56242477893829
Últimamente he estado fumando mucho debido al estrés. ¿Qué debería hacer?,"['Técnicas de respiración para reducir el estrés', 'La meditación mindfulness puede ayudar con la ansiedad', 'El ejercicio regular es beneficioso para la salud mental', 'Mantener un diario puede ayudar a procesar emociones', 'Establecer límites saludables en relaciones']","Lo siento mucho que estés pasando por un momento difícil y que el estrés te esté llevando a fumar más de lo habitual. Es completamente normal que busques formas de manejar el estrés y la ansiedad, y estoy aquí para ayudarte a explorar algunas opciones que podrían ser de ayuda.

En primer lugar, quiero decirte que no estás solo en esto. Muchas personas se ven afectadas por el estrés y la ansiedad, y hay muchas formas de manejarlas de manera saludable.

Una de las cosas que podrías probar es la técnica de respiración profunda. Aunque puede parecer simple, la respiración profunda puede ayudar a calmar el cuerpo y la mente. Puedes intentar respirar profundamente por la nariz, contener la respiración durante un momento, y luego exhalar lentamente por la boca. Repite esto varias veces y ve cómo te sientes.

Otra opción es la meditación mindfulness. La meditación puede ayudar a calmar la mente y a reducir la ansiedad. Puedes empezar con sesiones cortas de 5-10 minutos al día y ver cómo te sientes. Hay muchas aplicaciones y recursos en línea que pueden ayudarte a empezar.

El ejercicio regular también es beneficioso para la salud mental. Puedes intentar hacer algo que te guste, como caminar, correr, nadar o practicar yoga. El ejercicio puede ayudar a liberar endorfinas, que son químicos que pueden ayudar a mejorar el estado de ánimo.

Mantener un diario también puede ser una herramienta útil para procesar emociones. Puedes escribir sobre tus pensamientos y sentimientos, y ver cómo te sientes al escribir. Esto puede ayudarte a entender mejor tus emociones y a encontrar formas de manejarlas de manera saludable.

Finalmente, es importante recordar que establecer límites saludables en las relaciones puede ayudar a reducir el estrés y la ansiedad. Puedes intentar comunicarte de manera clara y directa con las personas que te rodean, y establecer límites que te hagan sentir seguro y respetado.

Recuerda que no hay una solución única para todos, y que lo importante es encontrar lo que funciona mejor para ti. ¿Te gustaría explorar alguna de estas opciones en más detalle? ¿Hay algo en particular que te gustaría hablar sobre? Estoy aquí para escucharte y ayudarte.","Es importante abordar tanto el estrés como el hábito de fumar. Busca alternativas saludables para manejar el estrés como ejercicio, técnicas de relajación, o hablar con alguien. Considera estrategias de cesación tabáquica gradual y busca apoyo profesional si es necesario.",1.0,0.0,0.6255681818181817,config_muchos_chunks,256,5,0.4,32.56242477893829
Mi relación con mi pareja me está causando mucho estrés y he comenzado a beber de nuevo. ¿Qué piensas que sería mejor hacer?,"['Técnicas de respiración para reducir el estrés', 'La meditación mindfulness puede ayudar con la ansiedad', 'Mantener un diario puede ayudar a procesar emociones', 'Técnicas para dejar de fumar', 'Estrategias para reducir el consumo de alcohol']","Lo siento mucho que estés pasando por un momento tan difícil en tu relación y que hayas vuelto a beber. Es importante que sepas que no estás solo y que hay ayuda disponible.

En primer lugar, quiero que sepas que es completamente normal sentirse estresado en una relación. La comunicación, la confianza y la empatía son fundamentales en cualquier relación saludable. Sin embargo, si sientes que la relación está causándote más daño que beneficio, es importante que consideres buscar ayuda profesional, como terapia de pareja o individual.

Mientras tanto, hay algunas cosas que podemos trabajar juntos para reducir tu estrés y ayudarte a manejar tus emociones de manera saludable.

Primero, te recomiendo que intentes practicar técnicas de respiración para reducir el estrés. Puedes intentar la respiración diafragmática, que consiste en respirar profundamente por la nariz y exhalar lentamente por la boca. También puedes intentar la respiración 4-7-8, que consiste en respirar por la nariz durante 4 segundos, retener el aire durante 7 segundos y exhalar por la boca durante 8 segundos.

Además, la meditación mindfulness puede ser muy útil para reducir la ansiedad y mejorar la claridad mental. Puedes intentar meditar durante 5-10 minutos al día, sentado en una posición cómoda y enfocándote en el presente momento. Puedes utilizar una aplicación como Headspace o Calm para guiar tus sesiones de meditación.

Mantener un diario también puede ser una excelente manera de procesar tus emociones y reflexionar sobre tus pensamientos y sentimientos. Puedes escribir sobre tus experiencias, tus miedos y tus esperanzas. Esto puede ayudarte a identificar patrones y a encontrar soluciones a tus problemas.

En cuanto a tu consumo de alcohol, es importante que te comprometas a reducirlo o a dejarlo completamente. Puedes intentar establecer límites para ti mismo, como no beber durante ciertas horas del día o no beber en ciertas situaciones. También puedes intentar encontrar alternativas saludables para manejar tus emociones, como practicar deporte, leer un libro o pasar tiempo con amigos y familiares.

Recuerda que no estás solo y que hay ayuda disponible. Si sientes que no puedes manejar tus emociones o que tu relación está causándote daño, no dudes en buscar ayuda profesional. Estoy aquí para apoyarte en este proceso.

¿Qué te parece si empezamos a trabajar en algunas de estas estrategias juntos? ¿Qué te gustaría intentar primero?","Es crucial abordar tanto los problemas de pareja como el consumo de alcohol. Considera terapia de pareja para mejorar la comunicación, busca apoyo para el tema del alcohol, y desarrolla estrategias saludables de manejo del estrés. No dudes en buscar ayuda profesional.",1.0,0.36363636363636365,1.0,config_muchos_chunks,256,5,0.4,32.56242477893829
Siento mucha ansiedad. ¿Cómo puedo reducirla?,"['Técnicas de respiración para reducir el estrés', 'La meditación mindfulness puede ayudar con la ansiedad', 'El ejercicio regular es beneficioso para la salud mental', 'Mantener un diario puede ayudar a procesar emociones', 'Establecer límites saludables en relaciones']","Lo siento mucho que estés sintiendo ansiedad. Es completamente normal y hay muchas cosas que puedes hacer para reducirla. Quiero que sepas que estás en un lugar seguro y que estoy aquí para ayudarte.

Primero, quiero hablar sobre algunas técnicas que pueden ayudarte a reducir la ansiedad. Una de ellas es la respiración profunda. Puedes intentar sentarte en un lugar tranquilo, con los pies en el suelo y las manos en el regazo. Cierra los ojos y enfócate en tu respiración. Respira profundamente por la nariz, llenando tus pulmones de aire, y luego exhala lentamente por la boca. Repite esto varias veces, sintiendo cómo tu cuerpo se relaja con cada exhalación.

Otra técnica que puede ayudarte es la meditación mindfulness. Puedes intentar sentarte en silencio durante unos minutos, enfocándote en el presente y en tus pensamientos y sentimientos sin juzgarlos. Puedes usar una aplicación o un video para guiarte, o simplemente sentarte en silencio y observar tus pensamientos y sentimientos.

El ejercicio regular también es beneficioso para la salud mental. Puedes intentar hacer algo que te guste, como caminar, correr, nadar o practicar yoga. El ejercicio puede ayudarte a liberar endorfinas, que son químicos que te hacen sentir bien y reducen la ansiedad.

Mantener un diario también puede ser una herramienta útil para procesar tus emociones. Puedes escribir sobre tus pensamientos y sentimientos, o simplemente anotar lo que te hace sentir bien y lo que te hace sentir mal. Esto puede ayudarte a entender mejor tus emociones y a encontrar patrones en tus pensamientos y comportamientos.

Finalmente, es importante establecer límites saludables en tus relaciones. Esto significa decir ""no"" cuando sea necesario, establecer límites claros con los demás y priorizar tus propias necesidades y deseos. Esto puede ayudarte a sentirte más seguro y en control, lo que puede reducir la ansiedad.

Recuerda que la ansiedad es algo común y que hay ayuda disponible. No estás solo y no tienes que enfrentar esto por tu cuenta. Si necesitas hablar con alguien, no dudes en buscar ayuda de un profesional de la salud mental.

¿Te gustaría hablar más sobre alguna de estas técnicas o sobre algo más que te preocupe? Estoy aquí para escucharte.","Para reducir la ansiedad, prueba técnicas de respiración profunda, ejercicios de relajación muscular progresiva, mindfulness, ejercicio regular, limitar la cafeína, mantener una rutina estable, y técnicas de reestructuración cognitiva. Si persiste, busca ayuda profesional.",1.0,0.0,0.7066666666666666,config_muchos_chunks,256,5,0.4,32.56242477893829
He tenido muchos pensamientos negativos últimamente. ¿Está relacionado con el estrés?,"['Técnicas para manejar pensamientos negativos', 'Técnicas de respiración para reducir el estrés', 'La meditación mindfulness puede ayudar con la ansiedad', 'El ejercicio regular es beneficioso para la salud mental', 'Estrategias para reducir el consumo de alcohol']","Entiendo que estás pasando por un momento difícil y que los pensamientos negativos te están afectando. Es completamente normal experimentar pensamientos negativos en momentos de estrés, pero es importante recordar que no estás solo en esto.

El estrés puede ser un factor que contribuye a los pensamientos negativos, pero también hay otras cosas que podrían estar en juego. Por ejemplo, podrías estar experimentando ansiedad, depresión o incluso una falta de propósito en tu vida.

Quiero compartir contigo algunas técnicas que podrían ayudarte a manejar estos pensamientos negativos y reducir el estrés:

1. **Técnicas de respiración**: La respiración profunda y consciente puede ayudarte a calmarte y reducir el estrés. Puedes intentar respirar profundamente por la nariz y exhalar lentamente por la boca, sintiendo cómo tu cuerpo se relaja con cada exhalación.
2. **Meditación mindfulness**: La meditación mindfulness puede ayudarte a estar presente en el momento y a reducir la ansiedad. Puedes intentar meditar durante 5-10 minutos al día, enfocándote en tu respiración o en tus sentidos.
3. **Ejercicio regular**: El ejercicio regular puede ayudarte a reducir el estrés y mejorar tu estado de ánimo. Puedes intentar hacer ejercicio durante 30 minutos al día, como caminar, correr o hacer yoga.
4. **Técnicas de pensamiento positivo**: Puedes intentar cambiar tus pensamientos negativos a pensamientos positivos. Por ejemplo, si te dices ""No puedo hacer esto"", puedes cambiarlo a ""Estoy dispuesto a aprender y mejorar"".
5. **Conexión con la naturaleza**: La conexión con la naturaleza puede ayudarte a reducir el estrés y mejorar tu estado de ánimo. Puedes intentar pasar tiempo al aire libre, caminando en un parque o simplemente sentándote en un jardín.

Recuerda que no estás solo en esto. Hay muchas personas que han pasado por lo mismo y han encontrado formas de manejar sus pensamientos negativos y reducir el estrés. ¿Te gustaría hablar más sobre alguna de estas técnicas o sobre algo que te esté afectando en particular?","Sí, el estrés puede intensificar los pensamientos negativos. Es importante practicar técnicas de reestructuración cognitiva, mindfulness, mantener un diario de pensamientos, buscar actividades que te den bienestar, y considerar hablar con un profesional si estos pensamientos persisten o interfieren con tu vida diaria.",1.0,0.7272727272727273,0.8013986013986013,config_muchos_chunks,256,5,0.4,32.56242477893829
"Cuando estoy estresado, no puedo trabajar. ¿Qué puedo hacer?","['Técnicas de respiración para reducir el estrés', 'La meditación mindfulness puede ayudar con la ansiedad', 'El ejercicio regular es beneficioso para la salud mental', 'Mantener un diario puede ayudar a procesar emociones', 'Establecer límites saludables en relaciones']","Entiendo que estás pasando por un momento difícil y que el estrés te está afectando en tu capacidad para trabajar. Quiero que sepas que no estás solo en esto. Hay muchas cosas que puedes hacer para manejar el estrés y mejorar tu productividad.

Primero, quiero hablar contigo sobre la importancia de la respiración. Cuando estamos estresados, nuestro ritmo cardíaco se acelera y nuestra respiración se vuelve superficial. Pero hay una técnica sencilla que puedes practicar para calmarte: la respiración diafragmática. Simplemente inhala profundamente a través de la nariz, permitiendo que tu vientre se expanda, y luego exhala lentamente a través de la boca. Repite esto varias veces y notarás cómo te sientes más calmado.

Otra herramienta que te recomiendo es la meditación mindfulness. No necesitas ser un experto en meditación para empezar. Simplemente encuentra un lugar tranquilo, cierra los ojos y enfócate en tu respiración. Si tu mente comienza a divagar, simplemente regresa a la respiración sin juzgar. La meditación puede ayudarte a calmar tu mente y a enfocarte en el presente.

El ejercicio regular también es una excelente manera de reducir el estrés. No necesitas hacer ejercicio intensivo, simplemente caminar durante 30 minutos al día puede hacer una gran diferencia. El ejercicio libera endorfinas, que son químicos que te hacen sentir bien y te ayudan a manejar el estrés.

Mantener un diario también puede ser una herramienta valiosa para procesar tus emociones. No necesitas escribir un diario formal, simplemente anota tus pensamientos y sentimientos en un cuaderno o en una aplicación en tu teléfono. Esto te ayudará a identificar patrones y a entender mejor tus emociones.

Finalmente, quiero hablar contigo sobre la importancia de establecer límites saludables en tus relaciones. A veces, podemos sentirnos abrumados por las expectativas de los demás o por nuestras propias expectativas. Recuerda que no puedes hacer todo por todos, y que es importante priorizar tus propias necesidades y límites.

Recuerda que el estrés es una parte natural de la vida, pero no tiene que controlarte. Hay muchas cosas que puedes hacer para manejarlo y mejorar tu productividad. ¿Quieres hablar más sobre alguna de estas herramientas o sobre algo que te esté preocupando en particular?","Para manejar el estrés que afecta tu productividad, prueba técnicas de organización del tiempo, toma descansos regulares, practica técnicas de relajación antes del trabajo, crea un ambiente de trabajo calmado, y considera técnicas de mindfulness. Es importante abordar las fuentes del estrés.",1.0,0.0,0.7649999999999999,config_muchos_chunks,256,5,0.4,32.56242477893829
No puedo comer como antes debido al estrés. ¿Qué puedo hacer?,"['Técnicas de respiración para reducir el estrés', 'La meditación mindfulness puede ayudar con la ansiedad', 'El ejercicio regular es beneficioso para la salud mental', 'Mantener un diario puede ayudar a procesar emociones', 'Establecer límites saludables en relaciones']","Entiendo que el estrés te está afectando en tu relación con la comida. Es completamente normal sentirse así cuando estamos bajo presión. Quiero que sepas que estás en un lugar seguro y que podemos trabajar juntos para encontrar formas de manejar el estrés y restaurar tu relación con la comida.

Antes de nada, quiero que sepas que no estás solo en esto. Muchas personas experimentan cambios en su apetito y relación con la comida debido al estrés. Hay muchas cosas que puedes hacer para ayudar a reducir el estrés y mejorar tu relación con la comida.

Una de las cosas que te recomiendo es practicar técnicas de respiración para reducir el estrés. La respiración profunda y lenta puede ayudar a calmar tu mente y cuerpo. Puedes intentar respirar profundamente por la nariz, retener el aire durante unos segundos y luego exhalar lentamente por la boca. Repite esto varias veces al día, especialmente cuando te sientas estresado.

Otra cosa que te recomiendo es practicar la meditación mindfulness. La meditación puede ayudar a reducir la ansiedad y mejorar tu estado de ánimo. Puedes intentar meditar durante unos minutos al día, sentado en una silla o en una posición cómoda en el suelo. Cierra los ojos y enfócate en tu respiración, sin juzgar tus pensamientos ni emociones. Solo permite que sean lo que son.

El ejercicio regular también es beneficioso para la salud mental. El ejercicio puede ayudar a reducir el estrés y mejorar tu estado de ánimo. Puedes intentar hacer algo que disfrutes, como caminar, correr, nadar o practicar yoga. Lo importante es encontrar algo que te haga sentir bien y que puedas hacer regularmente.

Mantener un diario también puede ser una herramienta útil para procesar tus emociones. Puedes escribir sobre tus sentimientos, pensamientos y experiencias. Esto puede ayudarte a entender mejor tus patrones de comportamiento y a identificar áreas en las que puedes trabajar para mejorar.

Finalmente, es importante establecer límites saludables en tus relaciones. A veces, el estrés puede provenir de las relaciones con los demás. Puedes intentar establecer límites claros y saludables con las personas que te rodean. Esto puede ayudarte a sentirte más seguro y en control.

Recuerda que no estás solo en esto. Estoy aquí para apoyarte y ayudarte a encontrar formas de manejar el estrés y mejorar tu relación con la comida. ¿Quieres hablar un poco más sobre lo que te está pasando y cómo te sientes?","El estrés puede afectar significativamente el apetito. Intenta comer pequeñas porciones frecuentes, mantén horarios regulares de comida, elige alimentos nutritivos y fáciles de digerir, practica técnicas de relajación antes de comer, y busca ayuda profesional si la pérdida de apetito persiste.",1.0,0.0,0.9942857142857142,config_muchos_chunks,256,5,0.4,32.56242477893829
