user_input,retrieved_contexts,response,reference,faithfulness,context_precision,answer_relevancy,configuracion,chunk_size,top_k,temperature,tiempo_promedio
Hoy me siento muy mal. ¿Podrías darme algunas técnicas que pueda aplicar?,"['Técnicas de respiración para reducir el estrés', 'Técnicas para manejar pensamientos negativos', 'Técnicas para dejar de fumar']","Lo siento mucho que estés pasando por un momento difícil. Como terapeuta conversacional, quiero que sepas que estás en un espacio seguro y apoyativo. Aquí te dejo algunas técnicas que podrían ayudarte a sentirte mejor:

**Técnicas de respiración para reducir el estrés**

1. **Respiración diafragmática**: Coloca una mano en tu abdomen y otra en tu pecho. Inhala profundamente a través de tu nariz, permitiendo que tu abdomen suba mientras tu mano en el abdomen se mueve hacia afuera. Exhala lentamente a través de tu boca, permitiendo que tu abdomen se mueva hacia adentro. Repite esto varias veces.
2. **Respiración 4-7-8**: Inhala por 4 segundos, retén el aire por 7 segundos y exhala por 8 segundos. Repite esto varias veces.
3. **Respiración profunda**: Inhala profundamente a través de tu nariz, llenando tus pulmones completamente. Mantén el aire dentro durante unos segundos, y luego exhala lentamente a través de tu boca.

**Técnicas para manejar pensamientos negativos**

1. **Reconocer y aceptar**: Reconoce que tus pensamientos negativos son solo pensamientos, y no necesariamente reflejan la realidad. Acepta que están allí, pero no los dejes definir tu experiencia.
2. **Reemplazar pensamientos negativos**: Cuando notes un pensamiento negativo, intenta reemplazarlo con un pensamiento positivo o neutro. Por ejemplo, si piensas ""No puedo hacer esto"", puedes reemplazarlo con ""Estoy dispuesto a intentarlo"".
3. **Practicar la gratitud**: Toma un momento para reflexionar sobre las cosas que estás agradecido por en tu vida. Esto puede ayudarte a cambiar tu enfoque y a ver las cosas de manera más positiva.

**Técnicas para dejar de fumar**

1. **Identificar los desencadenantes**: Identifica los momentos y situaciones que te llevan a fumar. Una vez que los hayas identificado, puedes desarrollar estrategias para evitarlos o manejarlos de manera diferente.
2. **Usar sustitutos**: Busca sustitutos para el acto de fumar, como mascar chicle o masticar goma de mascar.
3. **Practicar la relajación**: La relajación puede ayudarte a manejar el estrés y la ansiedad que a menudo se asocian con el deseo de fumar.

Recuerda que estas técnicas pueden ser útiles, pero es importante que busques ayuda profesional si sientes que necesitas apoyo adicional. ¿Quieres hablar un poco más sobre lo que estás experimentando y cómo te sientes?","Para sentirte mejor, puedes probar técnicas de respiración profunda, meditación mindfulness, ejercicio ligero, escribir en un diario, o hablar con alguien de confianza. Es importante identificar qué está causando estos sentimientos y buscar apoyo profesional si persiste.",1.0,0.16666666666666666,0.75,config_media_temperatura,256,3,0.4,31.807067304849625
¿Cómo puedo reducir mi nivel de estrés?,"['Técnicas de respiración para reducir el estrés', 'Estrategias para reducir el consumo de alcohol', 'Técnicas para dejar de fumar']","Entiendo que estás buscando formas de reducir tu nivel de estrés. Es completamente normal sentirse sobrecargado en la vida moderna. Como terapeuta, te puedo ofrecer algunas sugerencias que podrían ayudarte.

Primero, quiero mencionar la importancia de la respiración profunda. A veces, nuestro cuerpo puede estar en un estado de ""sobrecarga"" sin que nos demos cuenta. La respiración profunda puede ayudar a calmar nuestro sistema nervioso y reducir la ansiedad. Puedes intentar la técnica de respiración ""4-7-8"": inhala por la nariz durante 4 segundos, retén el aire durante 7 segundos y exhala por la boca durante 8 segundos. Repite este proceso varias veces al día.

Otra estrategia que podría ayudarte es reducir el consumo de alcohol. Aunque puede parecer que el alcohol te ayuda a relajarte en el momento, en realidad puede aumentar tu nivel de estrés a largo plazo. La falta de sueño, la deshidratación y los efectos secundarios del alcohol pueden empeorar tu estado de ánimo y aumentar la ansiedad. Considera reducir tu consumo de alcohol o buscar ayuda para dejar de beber.

También es importante mencionar que fumar puede aumentar el estrés y la ansiedad. Si eres fumador, considera buscar ayuda para dejar de fumar. La nicotina puede afectar tu sistema nervioso y aumentar la sensación de ansiedad. Hay muchas técnicas y recursos disponibles para ayudarte a dejar de fumar, como terapia cognitivo-conductual, grupos de apoyo y medicamentos de ayuda a la cesación del tabaquismo.

Además, es importante mencionar la importancia de la actividad física regular. El ejercicio puede ayudar a reducir el estrés y mejorar el estado de ánimo. Puedes intentar hacer algo que te guste, como caminar, correr, nadar o practicar yoga.

Finalmente, quiero recordarte que es importante buscar ayuda profesional si sientes que tu nivel de estrés es demasiado alto o si está afectando tu vida diaria. Un terapeuta puede ayudarte a identificar las causas subyacentes de tu estrés y desarrollar estrategias personalizadas para manejarlo.

¿Te gustaría hablar más sobre alguna de estas sugerencias o tienes alguna pregunta en particular?","Para reducir el estrés puedes implementar técnicas de relajación como respiración profunda, ejercicio regular, establecer límites claros, organizar tu tiempo, practicar mindfulness, mantener una rutina de sueño saludable y buscar apoyo social.",1.0,0.5714285714285714,1.0,config_media_temperatura,256,3,0.4,31.807067304849625
Últimamente he estado fumando mucho debido al estrés. ¿Qué debería hacer?,"['Técnicas de respiración para reducir el estrés', 'La meditación mindfulness puede ayudar con la ansiedad', 'El ejercicio regular es beneficioso para la salud mental']","Lo siento mucho que estés pasando por un momento difícil y que el estrés te esté llevando a fumar más de lo habitual. Es completamente normal sentirse abrumado en momentos como estos, pero hay algunas cosas que podemos explorar juntos para ayudarte a manejar el estrés de manera más saludable.

Primero, quiero decirte que no estás solo en esto. Muchas personas se ven afectadas por el estrés y buscan formas de manejarlo. Una de las cosas que podemos intentar es trabajar en técnicas de respiración para reducir el estrés. La respiración profunda y consciente puede ayudar a calmar el cuerpo y la mente, y es algo que puedes hacer en cualquier momento y en cualquier lugar.

Otra cosa que podríamos explorar es la meditación mindfulness. La meditación puede ayudar a reducir la ansiedad y el estrés al enfocarte en el presente y dejar ir pensamientos negativos. No necesitas ser un experto en meditación para empezar; simplemente encuentra un lugar tranquilo, cierra los ojos y enfócate en tu respiración.

También es importante recordar que el ejercicio regular es beneficioso para la salud mental. El ejercicio puede ayudar a reducir el estrés y la ansiedad al liberar endorfinas, que son químicos que te hacen sentir bien. No necesitas hacer un entrenamiento intensivo; incluso un paseo corto al aire libre puede hacer una gran diferencia.

Quiero que sepas que no estoy aquí para juzgarte o para decirte que dejes de fumar de la noche a la mañana. Mi objetivo es ayudarte a encontrar formas de manejar el estrés de manera más saludable y a encontrar un equilibrio que te permita sentirte mejor. ¿Te gustaría explorar alguna de estas opciones conmigo?","Es importante abordar tanto el estrés como el hábito de fumar. Busca alternativas saludables para manejar el estrés como ejercicio, técnicas de relajación, o hablar con alguien. Considera estrategias de cesación tabáquica gradual y busca apoyo profesional si es necesario.",1.0,0.0,0.5880681818181818,config_media_temperatura,256,3,0.4,31.807067304849625
Mi relación con mi pareja me está causando mucho estrés y he comenzado a beber de nuevo. ¿Qué piensas que sería mejor hacer?,"['Técnicas de respiración para reducir el estrés', 'La meditación mindfulness puede ayudar con la ansiedad', 'Mantener un diario puede ayudar a procesar emociones']","Lo siento mucho que estés pasando por esto. El estrés en una relación puede ser muy abrumador, y es comprensible que estés buscando formas de manejarlo. El hecho de que hayas comenzado a beber de nuevo es un signo de que algo no está funcionando bien, y es importante abordarlo de manera constructiva.

En primer lugar, quiero decirte que estás haciendo un gran paso al reconocer que hay un problema y buscar ayuda. Eso en sí mismo es un acto de valentía y autoconciencia.

En cuanto a lo que podrías hacer, te propongo algunas sugerencias:

1. **Practica técnicas de respiración**: La respiración profunda y consciente puede ayudarte a calmar tu mente y cuerpo. Puedes intentar la respiración diafragmática, la respiración 4-7-8 o cualquier otra técnica que te guste. Puedes encontrar muchos recursos en línea para aprender a respirar de manera efectiva.
2. **Practica la meditación mindfulness**: La meditación puede ayudarte a estar en el presente y a reducir la ansiedad. Puedes empezar con sesiones cortas de 5-10 minutos al día y aumentar la duración a medida que te sientas más cómodo. Puedes encontrar aplicaciones y recursos en línea para ayudarte a empezar.
3. **Mantén un diario**: Escribir sobre tus emociones y pensamientos puede ayudarte a procesar y entender mejor lo que estás experimentando. Puedes escribir sobre tus sentimientos, tus pensamientos y tus experiencias en la relación. Esto te puede ayudar a identificar patrones y a encontrar formas de mejorar la relación.
4. **Busca apoyo**: Habla con un amigo o familiar de confianza sobre lo que estás experimentando. También puedes considerar buscar la ayuda de un terapeuta o consejero que pueda ofrecerte apoyo y orientación.
5. **Considera la posibilidad de buscar ayuda para la relación**: Si la relación es el origen del estrés y la ansiedad, puede ser útil buscar ayuda para mejorarla. Un terapeuta o consejero puede ayudarte a identificar patrones y a encontrar formas de mejorar la comunicación y la conexión con tu pareja.

Recuerda que no estás solo en esto. Hay muchas personas que han pasado por experiencias similares y han encontrado formas de superarlas. Lo importante es que estés dispuesto a buscar ayuda y a trabajar en ti mismo.

¿Te gustaría hablar más sobre lo que estás experimentando y cómo te sientes en relación con tu pareja?","Es crucial abordar tanto los problemas de pareja como el consumo de alcohol. Considera terapia de pareja para mejorar la comunicación, busca apoyo para el tema del alcohol, y desarrolla estrategias saludables de manejo del estrés. No dudes en buscar ayuda profesional.",1.0,0.36363636363636365,0.9864935064935064,config_media_temperatura,256,3,0.4,31.807067304849625
Siento mucha ansiedad. ¿Cómo puedo reducirla?,"['Técnicas de respiración para reducir el estrés', 'La meditación mindfulness puede ayudar con la ansiedad', 'El ejercicio regular es beneficioso para la salud mental']","Entiendo que estás sintiendo mucha ansiedad y quieres encontrar formas de reducirla. Quiero que sepas que estás en un lugar seguro y que estoy aquí para ayudarte.

La ansiedad es un sentimiento común que muchos de nosotros experimentamos en algún momento de nuestras vidas. Hay varias técnicas que pueden ayudarte a reducirla, y te voy a compartir algunas de ellas.

Primero, te recomiendo practicar técnicas de respiración. La respiración profunda y lenta puede ayudar a calmar tu sistema nervioso y reducir la ansiedad. Puedes intentar respirar profundamente por la nariz, contando hasta cuatro, y luego exhalar lentamente por la boca, contando hasta seis. Repite este proceso varias veces.

Otra técnica que puede ayudarte es la meditación mindfulness. La meditación es una práctica que te permite enfocarte en el presente y dejar ir pensamientos y emociones negativas. Puedes empezar con sesiones cortas de cinco minutos al día y aumentar gradualmente el tiempo a medida que te sientas más cómodo con la práctica.

También es importante mencionar que el ejercicio regular es beneficioso para la salud mental. El ejercicio puede ayudar a reducir la ansiedad y mejorar el estado de ánimo. Puedes empezar con actividades ligeras como caminar o yoga, y luego aumentar la intensidad a medida que te sientas más cómodo.

Recuerda que la ansiedad es un proceso que requiere tiempo y paciencia para superar. No te sientas mal si no ves resultados inmediatos. Lo importante es que estás dispuesto a trabajar en ti mismo y encontrar formas de reducir la ansiedad.

¿Te gustaría intentar alguna de estas técnicas? ¿O hay algo en particular que te gustaría hablar sobre? Estoy aquí para escucharte y ayudarte en lo que pueda.","Para reducir la ansiedad, prueba técnicas de respiración profunda, ejercicios de relajación muscular progresiva, mindfulness, ejercicio regular, limitar la cafeína, mantener una rutina estable, y técnicas de reestructuración cognitiva. Si persiste, busca ayuda profesional.",1.0,0.0,0.6666666666666666,config_media_temperatura,256,3,0.4,31.807067304849625
He tenido muchos pensamientos negativos últimamente. ¿Está relacionado con el estrés?,"['Técnicas para manejar pensamientos negativos', 'Técnicas de respiración para reducir el estrés', 'La meditación mindfulness puede ayudar con la ansiedad']","Lo siento mucho que estés pasando por esto. Los pensamientos negativos pueden ser muy difíciles de manejar, y es común que estén relacionados con el estrés. El estrés puede afectar nuestra mente y cuerpo de muchas maneras, y puede llevar a pensamientos negativos, ansiedad y otros problemas de salud mental.

Quiero que sepas que no estás solo en esto. Muchas personas han pasado por lo mismo y han encontrado formas de manejar sus pensamientos negativos y reducir su estrés. Hay algunas técnicas que podrían ayudarte a sentirte mejor.

Una de las técnicas que podrías probar es la respiración profunda. La respiración profunda puede ayudar a calmar tu mente y cuerpo, reduciendo el estrés y la ansiedad. Puedes intentar respirar profundamente por la nariz, contener el aire durante unos segundos y luego exhalar lentamente por la boca. Repite este proceso varias veces para sentirte más calmado.

Otra técnica que podrías considerar es la meditación mindfulness. La meditación mindfulness es una práctica que te ayuda a estar presente en el momento, sin juzgar ni reaccionar a tus pensamientos. Puedes intentar sentarte en un lugar tranquilo, cerrar los ojos y enfocarte en tu respiración. Si tus pensamientos se desvían, simplemente los observas y regresas a tu respiración. La meditación mindfulness puede ayudarte a reducir la ansiedad y a sentirte más calmado.

También es importante recordar que los pensamientos negativos a menudo son como nubes que pasan por el cielo. No son la realidad, solo son pensamientos que pueden cambiar. Puedes intentar observar tus pensamientos negativos de manera objetiva, sin juzgarlos ni creerlos. Puedes decirte a ti mismo: ""Estoy teniendo un pensamiento negativo, pero no es la realidad"".

Recuerda que no estás solo en esto. Hay personas que se preocupan por ti y que quieren ayudarte. No dudes en buscar ayuda si necesitas hablar con alguien o si quieres aprender más sobre técnicas para manejar pensamientos negativos.

¿Te gustaría probar alguna de estas técnicas? ¿Hay algo en particular que te gustaría hablar sobre o que te gustaría cambiar?","Sí, el estrés puede intensificar los pensamientos negativos. Es importante practicar técnicas de reestructuración cognitiva, mindfulness, mantener un diario de pensamientos, buscar actividades que te den bienestar, y considerar hablar con un profesional si estos pensamientos persisten o interfieren con tu vida diaria.",1.0,0.7272727272727273,0.8321678321678321,config_media_temperatura,256,3,0.4,31.807067304849625
"Cuando estoy estresado, no puedo trabajar. ¿Qué puedo hacer?","['Técnicas de respiración para reducir el estrés', 'La meditación mindfulness puede ayudar con la ansiedad', 'El ejercicio regular es beneficioso para la salud mental']","Entiendo que el estrés te está afectando en tu capacidad para trabajar. Es completamente normal sentirse así, especialmente cuando estamos bajo presión. Quiero que sepas que no estás solo en esto.

Hay algunas cosas que podrías intentar para ayudarte a manejar el estrés y mejorar tu capacidad para trabajar:

1. **Técnicas de respiración**: La respiración profunda y consciente puede ayudarte a calmar tu mente y cuerpo. Puedes intentar la respiración diafragmática, donde inhalas profundamente por la nariz, mantienes el aire en los pulmones durante unos segundos y luego exhalas lentamente por la boca. Puedes hacer esto en cualquier momento, incluso mientras trabajas.
2. **Meditación mindfulness**: La meditación mindfulness puede ayudarte a estar más presente en el momento y a reducir la ansiedad. Puedes empezar con sesiones cortas de 5-10 minutos al día y aumentar la duración a medida que te sientas más cómodo con la práctica.
3. **Ejercicio regular**: El ejercicio físico puede ayudarte a reducir el estrés y mejorar tu estado de ánimo. Puedes empezar con actividades ligadas como caminar, correr o nadar, y luego aumentar la intensidad a medida que te sientas más cómodo.
4. **Tomar pausas**: Es importante tomar pausas durante el día para descansar y recargar energías. Puedes intentar tomar una pausa de 10-15 minutos cada hora para estirarte, respirar profundamente o hacer algo que te guste.
5. **Priorizar tareas**: A veces, el estrés puede provenir de la sensación de tener demasiadas tareas pendientes. Puedes intentar priorizar tus tareas y enfocarte en la más importante primero.
6. **Buscar apoyo**: No tienes que enfrentar esto solo. Puedes hablar con un amigo, familiar o profesional sobre cómo te sientes y buscar su apoyo y consejo.

Recuerda que el estrés es una parte normal de la vida, pero no tiene que controlarte. Hay muchas cosas que puedes hacer para manejarlo y mejorar tu capacidad para trabajar.

¿Te gustaría hablar más sobre alguna de estas opciones o tienes alguna otra pregunta?","Para manejar el estrés que afecta tu productividad, prueba técnicas de organización del tiempo, toma descansos regulares, practica técnicas de relajación antes del trabajo, crea un ambiente de trabajo calmado, y considera técnicas de mindfulness. Es importante abordar las fuentes del estrés.",1.0,0.0,0.7135714285714285,config_media_temperatura,256,3,0.4,31.807067304849625
No puedo comer como antes debido al estrés. ¿Qué puedo hacer?,"['Técnicas de respiración para reducir el estrés', 'La meditación mindfulness puede ayudar con la ansiedad', 'El ejercicio regular es beneficioso para la salud mental']","Entiendo que estás pasando por un momento difícil y que el estrés está afectando tu relación con la comida. Quiero que sepas que no estás solo en esto. Muchas personas experimentan cambios en su apetito y hábitos alimenticios cuando se sienten estresadas.

Primero, quiero que sepas que es normal que el estrés afecte nuestro apetito y nuestra relación con la comida. El estrés puede activar la respuesta de lucha o huida en nuestro cuerpo, lo que puede llevar a cambios en nuestro metabolismo y nuestro apetito.

Ahora, te voy a ofrecer algunas sugerencias que podrían ayudarte a manejar el estrés y mejorar tu relación con la comida:

1. **Técnicas de respiración**: La respiración profunda y consciente puede ayudarte a calmar tu mente y cuerpo. Puedes intentar la respiración diafragmática, que implica inhalar profundamente por la nariz, expandir el diafragma y exhalar lentamente por la boca. Puedes practicar esta técnica en cualquier momento del día.
2. **Meditación mindfulness**: La meditación mindfulness es una técnica que te ayuda a estar presente en el momento y a aceptar tus pensamientos y emociones sin juzgarlos. Puedes intentar meditar durante 5-10 minutos al día, sentado en una silla o en una posición cómoda en el suelo.
3. **Ejercicio regular**: El ejercicio es una excelente manera de reducir el estrés y mejorar la salud mental. Puedes intentar hacer ejercicio de 30 minutos al día, como caminar, correr, nadar o practicar yoga.
4. **Comer de manera consciente**: Cuando comas, intenta comer de manera consciente y sin distracciones. Puedes intentar comer en un ambiente tranquilo y sin televisión o teléfono. Esto te ayudará a disfrutar de tus comidas y a desarrollar una relación más saludable con la comida.
5. **Busca apoyo**: No dudes en buscar apoyo de amigos, familiares o un profesional de la salud mental si necesitas hablar sobre tus sentimientos y estrategias para manejar el estrés.

Recuerda que es importante ser paciente y compasivo contigo mismo. El estrés es una parte natural de la vida, y es normal que lo experimentemos de vez en cuando. Pero con práctica y paciencia, puedes desarrollar herramientas para manejar el estrés y mejorar tu relación con la comida.

¿Te gustaría hablar más sobre alguna de estas sugerencias o sobre algo que te preocupa en particular?","El estrés puede afectar significativamente el apetito. Intenta comer pequeñas porciones frecuentes, mantén horarios regulares de comida, elige alimentos nutritivos y fáciles de digerir, practica técnicas de relajación antes de comer, y busca ayuda profesional si la pérdida de apetito persiste.",1.0,0.0,0.9228571428571428,config_media_temperatura,256,3,0.4,31.807067304849625
