question,answer,context,reference,tiempo_respuesta
Hoy me siento muy mal. ¿Podrías darme algunas técnicas que pueda aplicar?,"Lo siento mucho que estés pasando por un mal momento. Como terapeuta conversacional, quiero que sepas que estás en un lugar seguro y que puedo ayudarte a encontrar algunas herramientas para manejar tus sentimientos.

Primero, te recomiendo intentar una técnica de respiración profunda para calmarte. Puedes sentarte cómodamente, con los pies en el suelo y las manos en el regazo. Cierra los ojos y respira profundamente por la nariz, llenando los pulmones de aire. Luego, exhala lentamente por la boca, permitiendo que el aire salga de tus pulmones. Repite este proceso varias veces, enfocándote en la sensación del aire entrando y saliendo de tus pulmones.

Otra técnica que te puede ayudar es la ""reestructuración de pensamientos"". A veces, nuestros pensamientos negativos pueden ser como una nube oscura que nos sigue. Pero podemos aprender a reescribirlos de manera más positiva y realista. Por ejemplo, si estás pensando ""No puedo con esto"", puedes reescribirlo como ""Estoy desafiado, pero puedo encontrar una solución"". O si estás pensando ""No soy lo suficientemente bueno"", puedes reescribirlo como ""Estoy haciendo mi mejor esfuerzo y eso es algo en lo que puedo sentir orgullo"".

Si estás buscando dejar de fumar, te recomiendo intentar la técnica de ""reemplazar el hábito"". Cuando te sientas tentado a fumar, intenta reemplazar el hábito con algo más saludable, como tomar un vaso de agua o hacer un ejercicio breve. También puedes intentar encontrar un compañero de apoyo que te ayude a mantener la motivación.

Recuerda que estas técnicas no son una solución mágica, pero pueden ayudarte a sentirte más calmado y a encontrar una perspectiva más positiva. ¿Quieres hablar un poco más sobre lo que te está pasando y cómo te sientes?",Técnicas de respiración para reducir el estrés | Técnicas para manejar pensamientos negativos | Técnicas para dejar de fumar,"Para sentirte mejor, puedes probar técnicas de respiración profunda, meditación mindfulness, ejercicio ligero, escribir en un diario, o hablar con alguien de confianza. Es importante identificar qué está causando estos sentimientos y buscar apoyo profesional si persiste.",27.292677640914917
¿Cómo puedo reducir mi nivel de estrés?,"Entiendo que estás buscando formas de reducir tu nivel de estrés. Es completamente normal sentirse sobrecargado en la vida moderna. Como terapeuta, puedo ofrecerte algunas sugerencias que podrían ayudarte a encontrar un poco de alivio.

Primero, quiero mencionar que la respiración profunda puede ser una herramienta muy poderosa para reducir el estrés. La respiración consciente puede ayudarte a calmarte y a enfocarte en el presente. Puedes intentar la técnica de la respiración 4-7-8, que implica respirar por la nariz durante 4 segundos, retener el aire durante 7 segundos y exhalar por la boca durante 8 segundos. Repite este ciclo varias veces para sentirte más relajado.

Otra sugerencia es reducir tu consumo de alcohol. El alcohol puede parecer una forma de relajarte en el momento, pero en realidad puede aumentar tu nivel de estrés a largo plazo. Puedes intentar reemplazar las noches de alcohol con actividades más saludables, como leer un libro, practicar yoga o salir a caminar con amigos.

Si eres fumador, también es importante considerar dejar de fumar. El tabaco es un estresor adicional que puede afectar tu salud y tu bienestar. Puedes intentar la técnica de ""no fumar"" durante un día o un fin de semana para ver cómo te sientes. También hay muchos recursos disponibles para ayudarte a dejar de fumar, como terapia de apoyo y programas de desintoxicación.

Además de estas sugerencias, también es importante recordar que el estrés puede ser un indicador de que necesitas hacer cambios en tu vida. ¿Hay algo en particular que te esté causando estrés? ¿Hay algo que puedas cambiar o mejorar en tu vida para reducir tu nivel de estrés? Como terapeuta, puedo ayudarte a explorar estas preguntas y a encontrar soluciones que se adapten a tus necesidades.

¿Te gustaría explorar más algunas de estas sugerencias o hablar sobre lo que te está causando estrés? Estoy aquí para escucharte y ayudarte.",Técnicas de respiración para reducir el estrés | Estrategias para reducir el consumo de alcohol | Técnicas para dejar de fumar,"Para reducir el estrés puedes implementar técnicas de relajación como respiración profunda, ejercicio regular, establecer límites claros, organizar tu tiempo, practicar mindfulness, mantener una rutina de sueño saludable y buscar apoyo social.",28.5844669342041
Últimamente he estado fumando mucho debido al estrés. ¿Qué debería hacer?,"Lo siento mucho que estés pasando por un momento tan difícil. El estrés puede ser un gran desafío, y el fumar puede ser una forma de intentar manejarlo, pero sabemos que no es la mejor opción a largo plazo. 

Quiero que sepas que estás en un lugar seguro y que estoy aquí para ayudarte. Hay algunas cosas que podrías intentar para reducir el estrés y dejar de fumar de manera efectiva.

Primero, te recomiendo que intentes algunas técnicas de respiración para calmarte. La respiración profunda y lenta puede ayudar a reducir la ansiedad y el estrés. Puedes intentar respirar profundamente por la nariz, retener el aire durante unos segundos y luego exhalar lentamente por la boca. Repite este proceso varias veces y ve cómo te sientes.

Otra cosa que podrías intentar es la meditación mindfulness. La meditación puede ayudarte a estar en el presente y a dejar ir pensamientos negativos. Puedes intentar meditar durante unos minutos al día, sentado en una silla o en una posición cómoda en el suelo. Cierra los ojos y enfócate en tu respiración, en tus sensaciones corporales o en el sonido de tu respiración. No te preocupes por pensar en nada en particular, solo permite que tus pensamientos fluyan sin juzgarlos.

También es importante recordar que el ejercicio regular es beneficioso para la salud mental. El ejercicio puede ayudar a reducir el estrés y la ansiedad, y puede mejorar tu estado de ánimo. Puedes intentar hacer algo que te guste, como caminar, correr, nadar o practicar yoga.

Recuerda que dejar de fumar es un proceso y que es normal sentir ansiedad o estrés al principio. Pero con el tiempo y la práctica, puedes desarrollar habilidades para manejar el estrés de manera saludable y dejar de fumar de manera efectiva.

¿Te gustaría intentar alguna de estas técnicas? ¿O hay algo más que te gustaría hablar sobre? Estoy aquí para ayudarte.",Técnicas de respiración para reducir el estrés | La meditación mindfulness puede ayudar con la ansiedad | El ejercicio regular es beneficioso para la salud mental,"Es importante abordar tanto el estrés como el hábito de fumar. Busca alternativas saludables para manejar el estrés como ejercicio, técnicas de relajación, o hablar con alguien. Considera estrategias de cesación tabáquica gradual y busca apoyo profesional si es necesario.",28.231289625167847
Mi relación con mi pareja me está causando mucho estrés y he comenzado a beber de nuevo. ¿Qué piensas que sería mejor hacer?,"Lo siento mucho que estés pasando por un momento tan difícil. La relación con tu pareja puede ser un tema muy complejo y estresante, y es normal que busques formas de manejar ese estrés. El hecho de que hayas comenzado a beber de nuevo es un signo de que algo no está funcionando bien, y es importante abordar esto de manera proactiva.

En primer lugar, quiero que sepas que estás en un lugar seguro y que puedo ayudarte a explorar algunas opciones para manejar el estrés y la ansiedad que estás experimentando.

Una de las cosas que podrías considerar es practicar técnicas de respiración para reducir el estrés. La respiración profunda y consciente puede ayudar a calmar el sistema nervioso y a reducir la ansiedad. Puedes intentar practicar la respiración diafragmática, que implica inhalar profundamente por la nariz y exhalar lentamente por la boca.

Otra opción es la meditación mindfulness. La meditación puede ayudar a calmar la mente y a reducir la ansiedad. Puedes intentar meditar durante unos minutos al día, enfocándote en el presente y en tus sensaciones físicas. No necesitas ser un experto en meditación para empezar; solo necesitas encontrar un lugar tranquilo y cómodo para sentarte y respirar profundamente.

También podrías considerar mantener un diario para procesar tus emociones. Escribe sobre lo que sientes y lo que piensas. Puedes escribir sobre tus sentimientos hacia tu pareja, sobre lo que te está causando estrés y sobre cómo te sientes al respecto. Esto puede ayudarte a clarificar tus pensamientos y a procesar tus emociones de manera más efectiva.

En cuanto a tu relación con tu pareja, es importante que tengas una conversación abierta y honesta sobre cómo te sientes. Puedes intentar hablar con tu pareja sobre lo que te está causando estrés y ver si hay formas de abordar los problemas juntos.

Recuerda que no estás solo en esto. Hay muchas personas que han pasado por situaciones similares y han encontrado formas de manejar el estrés y la ansiedad de manera efectiva. No dudes en buscar ayuda profesional si lo necesitas.

¿Te gustaría explorar alguna de estas opciones más a fondo? ¿O hay algo en particular que te gustaría hablar sobre?",Técnicas de respiración para reducir el estrés | La meditación mindfulness puede ayudar con la ansiedad | Mantener un diario puede ayudar a procesar emociones,"Es crucial abordar tanto los problemas de pareja como el consumo de alcohol. Considera terapia de pareja para mejorar la comunicación, busca apoyo para el tema del alcohol, y desarrolla estrategias saludables de manejo del estrés. No dudes en buscar ayuda profesional.",32.1415753364563
Siento mucha ansiedad. ¿Cómo puedo reducirla?,"Lo siento mucho que estés experimentando ansiedad. Es completamente normal sentirse así de vez en cuando, pero es genial que estés buscando formas de reducirla. Como terapeuta, te voy a ofrecer algunas sugerencias que podrían ayudarte.

Primero, quiero mencionar que la respiración es un gran aliado para reducir el estrés y la ansiedad. La técnica de respiración profunda es muy efectiva para calmar el cuerpo y la mente. Puedes intentar respirar profundamente por la nariz, contener el aire durante unos segundos y luego exhalar lentamente por la boca. Repite este proceso varias veces y nota cómo tu cuerpo se relaja.

Otra técnica que te recomiendo es la meditación mindfulness. La meditación puede ayudarte a centrarte en el presente y a dejar ir pensamientos negativos o preocupantes. Puedes intentar meditar sentado en una silla, con los ojos cerrados y la atención en tu respiración. Si tus pensamientos se desvían, simplemente los observas y los dejas ir sin juzgarlos. Puedes empezar con solo unos minutos al día y aumentar gradualmente el tiempo.

Además, el ejercicio regular es beneficioso para la salud mental. El ejercicio puede ayudar a reducir la ansiedad y mejorar el estado de ánimo. Puedes intentar hacer algo que disfrutes, como caminar, correr, nadar o practicar yoga. Lo importante es encontrar algo que te guste y que te haga sentir bien.

Recuerda que la ansiedad es un proceso natural y que no estás solo. Hay muchas personas que han pasado por lo mismo y han encontrado formas de manejarla. Te animo a explorar estas sugerencias y a encontrar lo que funciona mejor para ti. ¿Te gustaría hablar más sobre cómo te sientes y qué te parece intentar estas técnicas?",Técnicas de respiración para reducir el estrés | La meditación mindfulness puede ayudar con la ansiedad | El ejercicio regular es beneficioso para la salud mental,"Para reducir la ansiedad, prueba técnicas de respiración profunda, ejercicios de relajación muscular progresiva, mindfulness, ejercicio regular, limitar la cafeína, mantener una rutina estable, y técnicas de reestructuración cognitiva. Si persiste, busca ayuda profesional.",25.175009965896606
He tenido muchos pensamientos negativos últimamente. ¿Está relacionado con el estrés?,"Lo siento mucho que estés pasando por esto. Los pensamientos negativos pueden ser muy difíciles de manejar, y es normal que te preguntes si están relacionados con el estrés.

En primer lugar, quiero decirte que no estás solo en esto. Muchas personas experimentan pensamientos negativos en algún momento de su vida, y hay muchas formas de manejarlos. El estrés puede ser un factor que contribuya a la aparición de pensamientos negativos, pero no es la única causa.

Me gustaría hablar contigo sobre algunas técnicas que podrían ayudarte a manejar tus pensamientos negativos y reducir el estrés. Una de ellas es la respiración profunda. Cuando estamos estresados, nuestro ritmo cardíaco y nuestra respiración se aceleran, lo que puede empeorar la situación. La respiración profunda puede ayudarte a calmar tu cuerpo y tu mente, y a reducir el estrés.

Otra técnica que podría ser útil es la meditación mindfulness. La meditación mindfulness es una práctica que te ayuda a estar presente en el momento, sin juzgar ni criticar tus pensamientos ni sentimientos. Puede ayudarte a desarrollar una mayor conciencia de tus pensamientos y sentimientos, y a aprender a manejarlos de manera más efectiva.

También me gustaría hablar contigo sobre la técnica de la ""reestructuración cognitiva"". Esta técnica implica identificar tus pensamientos negativos y reemplazarlos con pensamientos más realistas y positivos. Por ejemplo, si te dices a ti mismo ""Nunca voy a poder hacer esto"", podrías reemplazarlo con ""Estoy nervioso, pero puedo hacer esto paso a paso"".

¿Te gustaría explorar alguna de estas técnicas conmigo? ¿Hay algo en particular que te gustaría hablar sobre o que te gustaría cambiar? Estoy aquí para ayudarte.",Técnicas para manejar pensamientos negativos | Técnicas de respiración para reducir el estrés | La meditación mindfulness puede ayudar con la ansiedad,"Sí, el estrés puede intensificar los pensamientos negativos. Es importante practicar técnicas de reestructuración cognitiva, mindfulness, mantener un diario de pensamientos, buscar actividades que te den bienestar, y considerar hablar con un profesional si estos pensamientos persisten o interfieren con tu vida diaria.",25.274065256118774
"Cuando estoy estresado, no puedo trabajar. ¿Qué puedo hacer?","Entiendo que estás pasando por un momento difícil y que el estrés te está afectando en tu capacidad para trabajar. Quiero que sepas que no estás solo en esto. Hay muchas cosas que puedes hacer para manejar el estrés y mejorar tu productividad.

Primero, te recomiendo practicar técnicas de respiración para reducir el estrés. La respiración profunda y lenta puede ayudarte a calmarte y a enfocarte en el momento presente. Puedes intentar la respiración diafragmática, que implica inhalar profundamente por la nariz, expandir el diafragma y exhalar lentamente por la boca. También puedes intentar la respiración 4-7-8, que implica inhalar durante 4 segundos, retener el aire durante 7 segundos y exhalar durante 8 segundos.

Otra herramienta que te recomiendo es la meditación mindfulness. La meditación puede ayudarte a desarrollar la conciencia y la aceptación de tus pensamientos y emociones, lo que puede reducir la ansiedad y el estrés. Puedes empezar con sesiones cortas de 5-10 minutos y aumentar la duración a medida que te sientas más cómodo con la práctica.

Finalmente, te recomiendo hacer ejercicio regularmente. El ejercicio puede ayudarte a reducir el estrés y la ansiedad, mejorar tu estado de ánimo y aumentar tu energía. Puedes empezar con actividades que te gusten, como caminar, correr, nadar o practicar yoga.

Recuerda que no hay una solución mágica para el estrés, pero con la práctica y la paciencia, puedes desarrollar herramientas y estrategias para manejarlo de manera efectiva. ¿Te gustaría hablar más sobre alguna de estas técnicas o sobre cómo puedes incorporarlas en tu vida diaria?",Técnicas de respiración para reducir el estrés | La meditación mindfulness puede ayudar con la ansiedad | El ejercicio regular es beneficioso para la salud mental,"Para manejar el estrés que afecta tu productividad, prueba técnicas de organización del tiempo, toma descansos regulares, practica técnicas de relajación antes del trabajo, crea un ambiente de trabajo calmado, y considera técnicas de mindfulness. Es importante abordar las fuentes del estrés.",24.726996183395386
No puedo comer como antes debido al estrés. ¿Qué puedo hacer?,"Entiendo que el estrés te ha estado afectando en tu relación con la comida. Es común que el estrés y la ansiedad nos hagan perder el apetito o nos causen problemas para comer de manera normal. 

Quiero que sepas que no estás solo en esto. Muchas personas experimentan esto y hay cosas que puedes hacer para ayudarte a manejar el estrés y mejorar tu relación con la comida.

Una de las primeras cosas que te recomiendo es practicar técnicas de respiración para reducir el estrés. Puedes intentar la respiración diafragmática, que consiste en inhalar profundamente por la nariz, expandir el diafragma y exhalar lentamente por la boca. Esto puede ayudarte a calmar tu sistema nervioso y a reducir la ansiedad.

Otra técnica que te recomiendo es la meditación mindfulness. La meditación puede ayudarte a estar presente en el momento y a reducir la ansiedad y el estrés. Puedes intentar meditar durante unos minutos al día, sentado en una silla o en una posición cómoda en el suelo. Cierra los ojos y enfócate en tu respiración, sin juzgar ni intentar controlarla. Simplemente permite que sea lo que sea.

También es importante recordar que el ejercicio regular es beneficioso para la salud mental. El ejercicio puede ayudarte a reducir el estrés y la ansiedad, y a mejorar tu estado de ánimo. Puedes intentar hacer algo que disfrutes, como caminar, correr, nadar o practicar yoga.

Además, te recomiendo que intentes comer de manera más consciente y relajada. Puedes intentar comer despacio, sin distracciones, y enfocarte en el sabor, la textura y el aroma de la comida. Esto puede ayudarte a disfrutar de la comida de manera más plena y a reducir la ansiedad alrededor de la comida.

Recuerda que es importante ser paciente y compasivo contigo mismo. El estrés y la ansiedad pueden ser difíciles de manejar, pero hay cosas que puedes hacer para ayudarte a sentirte mejor. ¿Te gustaría hablar más sobre cómo te sientes y qué te parece intentar estas técnicas?",Técnicas de respiración para reducir el estrés | La meditación mindfulness puede ayudar con la ansiedad | El ejercicio regular es beneficioso para la salud mental,"El estrés puede afectar significativamente el apetito. Intenta comer pequeñas porciones frecuentes, mantén horarios regulares de comida, elige alimentos nutritivos y fáciles de digerir, practica técnicas de relajación antes de comer, y busca ayuda profesional si la pérdida de apetito persiste.",30.20002007484436
