pregunta,respuesta,pnl_techniques,quality_indicators,promedio_pnl,promedio_calidad
Hoy me siento muy mal. ¿Podrías darme algunas técnicas que pueda aplicar?,"Lo siento mucho que te sientas mal hoy. Como terapeuta conversacional, quiero que sepas que estás en un lugar seguro y que puedo ayudarte a encontrar algunas técnicas que puedan ayudarte a sentirte mejor.

Primero, te voy a pedir que te tomes un momento para respirar profundamente y relajarte. ¿Puedes sentarte cómodamente y cerrar los ojos por un momento?

Ahora, te voy a compartir algunas técnicas que podrían ayudarte a reducir el estrés y mejorar tu estado de ánimo.

**Técnicas de respiración para reducir el estrés**

1. **Respiración diafragmática**: Inspira profundamente a través de la nariz, permitiendo que tu diafragma se expanda hacia abajo. Luego, exhala lentamente a través de la boca, permitiendo que tu diafragma se contraiga hacia arriba. Repite esto varias veces.
2. **Respiración 4-7-8**: Inspira por 4 segundos, retén la respiración por 7 segundos y exhala por 8 segundos. Repite esto varias veces.
3. **Respiración de la ""casa de la respiración""**: Imagina que tienes una casa en tu cuerpo, y que la respiración comienza en la base de la casa (la parte inferior del abdomen). Inspira profundamente, permitiendo que la casa se llene de aire. Luego, exhala lentamente, permitiendo que la casa se vacíe.

**Técnicas para manejar pensamientos negativos**

1. **Reconocer y aceptar**: Reconoce que tus pensamientos negativos son solo pensamientos, y no reflejan la realidad. Acepta que es normal tener pensamientos negativos, pero no los permitas que te controlen.
2. **Reemplazar pensamientos negativos**: Cuando tengas un pensamiento negativo, intenta reemplazarlo con un pensamiento positivo o neutral. Por ejemplo, si piensas ""No puedo hacer esto"", intenta reemplazarlo con ""Puedo hacer esto, y voy a hacerlo lo mejor que pueda"".
3. **Practicar la gratitud**: Toma un momento para reflexionar sobre las cosas que estás agradecido por en tu vida. Esto puede ayudarte a cambiar tu enfoque y a enfocarte en lo positivo.

**Técnicas para dejar de fumar**

1. **Identificar los desencadenantes**: Identifica los momentos y situaciones en los que tiendes a fumar. Una vez que los identifiques, puedes desarrollar estrategias para evitarlos o manejarlos de manera diferente.
2. **Usar sustitutos**: Busca sustitutos para el tabaco, como chicle, goma de mascar o un palo de madera. Esto puede ayudarte a satisfacer el impulso de fumar sin consumir tabaco.
3. **Practicar la relajación**: La relajación puede ayudarte a reducir el estrés y la ansiedad, lo que puede contribuir a que dejes de fumar. Prueba las técnicas de respiración que te mencioné anteriormente.

Recuerda que estas técnicas pueden ayudarte a sentirte mejor, pero no son una sustitución para la ayuda profesional. Si te sientes abrumado o necesitas apoyo adicional, no dudes en buscar ayuda de un profesional de la salud mental.

¿Te gustaría hablar más sobre alguna de estas técnicas o sobre algo que te esté pasando en este momento? Estoy aquí para escucharte y ayudarte.","{'rapport': 20.0, 'metamodelo': 0.0, 'anclaje': 12.5, 'reencuadre': 0.0, 'preguntas_poderosas': 0.0}","{'exploración': 0.0, 'profundización': 0.0, 'recomendación': 25.0, 'personalización': 0.0, 'tono cálido': 12.5, 'evita lenguaje clínico': 100.0, 'normaliza sentimientos': 14.285714285714285}",6.5,21.683673469387752
¿Cómo puedo reducir mi nivel de estrés?,"Entiendo que estás buscando formas de reducir tu nivel de estrés. Es completamente normal sentirse sobrecargado en momentos de la vida. Como terapeuta, te puedo ofrecer algunas sugerencias que podrían ayudarte a manejar el estrés de manera efectiva.

Primero, quiero mencionar que la respiración profunda es una herramienta poderosa para reducir el estrés. La respiración profunda puede ayudar a calmar el sistema nervioso y a reducir la ansiedad. Puedes intentar la técnica de respiración 4-7-8, que implica respirar por la nariz durante 4 segundos, retener el aire durante 7 segundos y exhalar por la boca durante 8 segundos. Repite este ciclo varias veces para sentirte más relajado.

Otra estrategia que te recomiendo es reducir tu consumo de alcohol. El alcohol puede parecer una forma de relajarse, pero en realidad puede aumentar el estrés a largo plazo. Si te sientes tentado a beber para calmarte, intenta encontrar otras formas de relajarte, como leer un libro, escuchar música o practicar yoga.

Si eres fumador, también es importante considerar dejar de fumar. El tabaco puede aumentar el estrés y la ansiedad, y dejar de fumar puede tener beneficios significativos para tu salud mental y física. Hay muchas recursos disponibles para ayudarte a dejar de fumar, como terapia de apoyo, grupos de apoyo y medicamentos para la abstinencia.

Además de estas estrategias, también te recomiendo considerar otras formas de reducir tu estrés, como:

* Practicar ejercicio regularmente, como caminar o correr, para liberar endorfinas y reducir la ansiedad.
* Establecer límites claros con tus amigos y familiares para evitar sentirte sobrecargado.
* Priorizar tus tareas y enfocarte en una cosa a la vez para reducir la sensación de estrés.
* Buscar apoyo de amigos, familiares o un terapeuta para hablar sobre tus sentimientos y estrategias para manejar el estrés.

Recuerda que cada persona es única, y lo que funciona para una persona puede no funcionar para otra. Lo importante es encontrar lo que funciona para ti y hacerlo una parte de tu rutina diaria.

¿Te gustaría hablar más sobre alguna de estas estrategias o tienes alguna pregunta en particular? Estoy aquí para ayudarte.","{'rapport': 20.0, 'metamodelo': 0.0, 'anclaje': 0.0, 'reencuadre': 0.0, 'preguntas_poderosas': 0.0}","{'exploración': 0.0, 'profundización': 0.0, 'recomendación': 25.0, 'personalización': 16.666666666666664, 'tono cálido': 12.5, 'evita lenguaje clínico': 100.0, 'normaliza sentimientos': 14.285714285714285}",4.0,24.064625850340132
Últimamente he estado fumando mucho debido al estrés. ¿Qué debería hacer?,"Entiendo que estás pasando por un momento difícil y que el estrés te está llevando a fumar más de lo habitual. Quiero que sepas que no estás solo en esto. Muchas personas se ven afectadas por el estrés y buscan formas de manejarlo de manera saludable.

Antes de nada, quiero felicitarte por reconocer que necesitas hacer algo al respecto. Eso ya es un gran paso. Ahora, te voy a ofrecer algunas sugerencias que podrían ayudarte a reducir el estrés y dejar de fumar de manera más efectiva.

Primero, te recomiendo que intentes practicar técnicas de respiración profunda. Puedes hacerlo en cualquier momento y en cualquier lugar. Simplemente inhala profundamente por la nariz, retén el aire durante unos segundos y exhala lentamente por la boca. Esto puede ayudarte a calmar tu mente y a reducir la ansiedad.

Otra opción es la meditación mindfulness. Puedes empezar con sesiones cortas de 5-10 minutos al día y luego aumentar el tiempo a medida que te sientas más cómodo con la práctica. La meditación puede ayudarte a estar más presente en el momento y a reducir la ansiedad y el estrés.

También te recomiendo que intentes incorporar ejercicio regular en tu rutina. No necesitas ser un atleta o hacer ejercicio intensivo. Simplemente un paseo corto al aire libre o una sesión de yoga en casa puede hacer maravillas para tu salud mental y física.

Recuerda que dejar de fumar es un proceso y que no es fácil. Pero con la ayuda de estas técnicas y un poco de determinación, puedes superar el estrés y dejar de fumar de manera más efectiva.

¿Te gustaría hablar un poco más sobre cómo te sientes y qué te parece intentar estas técnicas? Estoy aquí para escucharte y apoyarte en este proceso.","{'rapport': 20.0, 'metamodelo': 0.0, 'anclaje': 0.0, 'reencuadre': 0.0, 'preguntas_poderosas': 0.0}","{'exploración': 0.0, 'profundización': 0.0, 'recomendación': 12.5, 'personalización': 0.0, 'tono cálido': 0.0, 'evita lenguaje clínico': 100.0, 'normaliza sentimientos': 28.57142857142857}",4.0,20.153061224489793
Mi relación con mi pareja me está causando mucho estrés y he comenzado a beber de nuevo. ¿Qué piensas que sería mejor hacer?,"Lo siento mucho que estés pasando por un momento tan difícil en tu relación y que estés experimentando estrés y ansiedad. Beber de nuevo puede ser un mecanismo de escape para intentar manejar esos sentimientos, pero en realidad puede empeorar la situación a largo plazo.

Quiero que sepas que estás en un lugar seguro y que puedo ayudarte a explorar algunas opciones para manejar el estrés y la ansiedad que estás experimentando.

Primero, me gustaría que sepas que no estás solo en esto. Muchas personas han pasado por situaciones similares y han encontrado formas de superarlas. 

Una de las cosas que podrías intentar es practicar técnicas de respiración para reducir el estrés. Hay varias opciones que podrían funcionar para ti, como la respiración diafragmática, la respiración 4-7-8 o la respiración de la caja torácica. Estas técnicas pueden ayudarte a calmarte y a reducir la ansiedad en el momento.

Otra opción que podrías considerar es la meditación mindfulness. La meditación puede ayudarte a estar en el presente y a dejar ir pensamientos y emociones negativas. Puedes empezar con sesiones cortas y aumentar la duración a medida que te sientas más cómodo con la práctica.

También podría ser útil mantener un diario para procesar tus emociones y pensamientos. Esto puede ayudarte a identificar patrones y a entender mejor qué te está causando estrés y ansiedad en tu relación. Al escribir en tu diario, puedes también empezar a encontrar formas de manejar esos sentimientos de manera más saludable.

Además, podrías considerar hablar con tu pareja sobre cómo te sientes y qué necesitas de ella. A veces, comunicarse abiertamente y honestamente puede ayudar a resolver conflictos y a mejorar la relación.

Recuerda que no estás solo en esto y que hay ayuda disponible. Si te sientes cómodo, podríamos trabajar juntos para encontrar formas de manejar el estrés y la ansiedad que estás experimentando.

¿Te gustaría explorar alguna de estas opciones o hay algo más que te gustaría hablar sobre?","{'rapport': 0.0, 'metamodelo': 0.0, 'anclaje': 0.0, 'reencuadre': 0.0, 'preguntas_poderosas': 0.0}","{'exploración': 12.5, 'profundización': 0.0, 'recomendación': 0.0, 'personalización': 16.666666666666664, 'tono cálido': 0.0, 'evita lenguaje clínico': 100.0, 'normaliza sentimientos': 14.285714285714285}",0.0,20.493197278911563
Siento mucha ansiedad. ¿Cómo puedo reducirla?,"Lo siento mucho que estés sintiendo ansiedad. Es completamente normal y hay muchas cosas que puedes hacer para ayudar a reducirla. Quiero que sepas que estás en un lugar seguro y que estoy aquí para ayudarte.

Una de las cosas que puedo sugerirte es practicar técnicas de respiración. A veces, nuestra respiración se vuelve rápida y superficial cuando estamos ansiosos, lo que puede empeorar la situación. Sin embargo, si podemos aprender a respirar de manera más profunda y lenta, podemos ayudar a calmar nuestro cuerpo y mente.

Una técnica sencilla es la respiración diafragmática. Puedes sentarte cómodamente, con los pies en el suelo y las manos en el regazo. Luego, coloca una mano en tu estómago y otra en tu pecho. Respira profundamente a través de tu nariz, permitiendo que tu estómago suba hacia arriba mientras tu mano lo siente. Luego, exhala lentamente a través de tu boca, permitiendo que tu estómago baje hacia abajo. Repite este proceso varias veces.

Otra técnica que puede ayudar es la meditación mindfulness. La meditación es una práctica que nos ayuda a estar presentes en el momento, sin juzgar ni criticar. Puedes sentarte en un lugar tranquilo, cerrar los ojos y enfocarte en tu respiración. Si tu mente comienza a divagar, no te preocupes. Simplemente regresa a tu respiración y sigue adelante. La meditación puede ayudar a reducir la ansiedad y mejorar la calma y la claridad mental.

Finalmente, el ejercicio regular es beneficioso para la salud mental. El ejercicio puede ayudar a reducir la ansiedad y la depresión, mejorar la salud cardiovascular y aumentar la energía y la motivación. Puedes empezar con actividades que te gusten, como caminar, correr, nadar o practicar yoga. Lo importante es encontrar algo que te haga sentir bien y que puedas hacer con regularidad.

Recuerda que la ansiedad es algo común y que hay ayuda disponible. No estás solo y no tienes que enfrentar esto por tu cuenta. Si necesitas hablar con alguien o si la ansiedad se vuelve demasiado intensa, no dudes en buscar ayuda profesional. Estoy aquí para apoyarte en cualquier momento que lo necesites. ¿Te gustaría probar alguna de estas técnicas o hablar más sobre cómo te sientes?","{'rapport': 0.0, 'metamodelo': 0.0, 'anclaje': 0.0, 'reencuadre': 0.0, 'preguntas_poderosas': 0.0}","{'exploración': 0.0, 'profundización': 0.0, 'recomendación': 0.0, 'personalización': 0.0, 'tono cálido': 0.0, 'evita lenguaje clínico': 100.0, 'normaliza sentimientos': 28.57142857142857}",0.0,18.36734693877551
He tenido muchos pensamientos negativos últimamente. ¿Está relacionado con el estrés?,"Entiendo que estás pasando por un momento difícil y que los pensamientos negativos te están afectando. El estrés es un factor común que puede contribuir a la aparición de pensamientos negativos, pero no es la única causa. Hay muchas razones por las que podemos experimentar pensamientos negativos, como la ansiedad, la depresión, la falta de sueño, la dieta, la falta de ejercicio, entre otras.

Quiero que sepas que no estás solo en esto. Muchas personas experimentan pensamientos negativos y hay formas de manejarlos de manera efectiva. Una de las primeras cosas que podemos hacer es identificar los patrones de pensamiento negativos y aprender a reemplazarlos con pensamientos más positivos y realistas.

Una técnica que puede ayudarte es la de la ""reestructuración cognitiva"". Esto implica identificar los pensamientos negativos y reemplazarlos con pensamientos más positivos y realistas. Por ejemplo, si tienes el pensamiento ""No puedo hacer esto"", puedes reemplazarlo con ""Estoy dispuesto a aprender y mejorar"".

Otra técnica que puede ayudarte es la de la ""meditación mindfulness"". La meditación mindfulness es una práctica que te ayuda a estar presente en el momento y a dejar ir los pensamientos negativos. Puedes empezar con sesiones cortas de 5-10 minutos al día y aumentar la duración a medida que te sientas más cómodo con la práctica.

También es importante mencionar que la respiración profunda puede ayudar a reducir el estrés y los pensamientos negativos. Puedes intentar hacer ejercicios de respiración profunda, como la respiración diafragmática, para ayudar a calmar tu mente y cuerpo.

Recuerda que no estás solo en esto y que hay ayuda disponible. Si te sientes abrumado o necesitas hablar con alguien, no dudes en buscar ayuda de un profesional de la salud mental.

¿Te gustaría explorar más sobre alguna de estas técnicas o hablar sobre tus pensamientos negativos en particular?","{'rapport': 10.0, 'metamodelo': 0.0, 'anclaje': 0.0, 'reencuadre': 0.0, 'preguntas_poderosas': 0.0}","{'exploración': 12.5, 'profundización': 14.285714285714285, 'recomendación': 0.0, 'personalización': 0.0, 'tono cálido': 0.0, 'evita lenguaje clínico': 100.0, 'normaliza sentimientos': 28.57142857142857}",2.0,22.193877551020403
"Cuando estoy estresado, no puedo trabajar. ¿Qué puedo hacer?","Entiendo que estás pasando por un momento difícil y que el estrés te está afectando en tu capacidad para trabajar. Quiero que sepas que no estás solo en esto. Muchas personas han pasado por lo mismo y han encontrado formas de manejar el estrés de manera efectiva.

Primero, quiero que sepas que es completamente normal sentirse estresado y que no hay nada de malo en reconocer que necesitas ayuda. Ahora, vamos a explorar algunas estrategias que podrían ayudarte a reducir el estrés y mejorar tu capacidad para trabajar.

**Técnicas de respiración**: La respiración profunda y consciente puede ser una herramienta muy poderosa para reducir el estrés. Puedes intentar respirar profundamente por la nariz, contener el aire durante unos segundos y luego exhalar lentamente por la boca. Repite este proceso varias veces y observa cómo te sientes. La respiración puede ayudarte a calmarte y a enfocarte en el momento presente.

**Meditación mindfulness**: La meditación mindfulness es una técnica que puede ayudarte a estar más presente en el momento y a reducir la ansiedad. Puedes intentar sentarte en un lugar tranquilo, cerrar los ojos y enfocarte en tu respiración. Si te sientes distraído, no te preocupes, simplemente regresa a la respiración. La meditación mindfulness puede ayudarte a desarrollar una mayor conciencia de ti mismo y a reducir el estrés.

**Ejercicio regular**: El ejercicio regular es beneficioso para la salud mental y puede ayudarte a reducir el estrés. Puedes intentar hacer algo que te guste, como caminar, correr, nadar o practicar yoga. El ejercicio puede ayudarte a liberar endorfinas, que son químicos que te hacen sentir bien y te ayudan a manejar el estrés.

**Otros consejos**: Además de estas técnicas, hay algunas otras cosas que podrías intentar para reducir el estrés y mejorar tu capacidad para trabajar. Por ejemplo, puedes intentar:

* Establecer límites claros con tus responsabilidades y priorizar tus tareas.
* Tomar descansos regulares para estirarte y moverte.
* Hablar con alguien de confianza sobre cómo te sientes.
* Buscar ayuda profesional si el estrés te está afectando de manera significativa.

Recuerda que no estás solo en esto y que hay muchas personas que pueden ayudarte. ¿Te gustaría explorar alguna de estas opciones en más detalle?","{'rapport': 10.0, 'metamodelo': 0.0, 'anclaje': 0.0, 'reencuadre': 0.0, 'preguntas_poderosas': 0.0}","{'exploración': 12.5, 'profundización': 0.0, 'recomendación': 0.0, 'personalización': 0.0, 'tono cálido': 0.0, 'evita lenguaje clínico': 100.0, 'normaliza sentimientos': 28.57142857142857}",2.0,20.153061224489793
No puedo comer como antes debido al estrés. ¿Qué puedo hacer?,"Entiendo que estás pasando por un momento difícil y que el estrés está afectando tu relación con la comida. Es completamente normal sentirse así, y estoy aquí para ayudarte a encontrar algunas estrategias para manejar el estrés y mejorar tu relación con la comida.

Primero, quiero decirte que no estás solo en esto. Muchas personas experimentan cambios en su apetito y relación con la comida cuando se sienten estresadas. Ahora, vamos a explorar algunas técnicas que podrían ayudarte a reducir el estrés y mejorar tu relación con la comida.

**Técnicas de respiración para reducir el estrés**

La respiración profunda y consciente puede ser una herramienta poderosa para reducir el estrés y la ansiedad. Puedes intentar la técnica de respiración ""4-7-8"", que implica:

1. Inspirar profundamente por la nariz durante 4 segundos.
2. Retener la respiración durante 7 segundos.
3. Exhalar lentamente por la boca durante 8 segundos.

Repite este ciclo varias veces al día, especialmente cuando te sientas estresado o ansioso.

**Meditación mindfulness**

La meditación mindfulness es una técnica que puede ayudarte a estar presente en el momento y a reducir la ansiedad y el estrés. Puedes intentar la meditación mindfulness de la siguiente manera:

1. Encuentra un lugar tranquilo y cómodo donde puedas sentarte sin distracciones.
2. Cierra los ojos y enfócate en tu respiración.
3. Nota el flujo de la respiración en tu cuerpo, sin intentar cambiarla o controlarla.
4. Cuando tu mente comience a divagar, simplemente nota el pensamiento y regresa a la respiración.

Puedes empezar con sesiones de meditación de 5-10 minutos al día y aumentar la duración a medida que te sientas más cómodo con la práctica.

**Ejercicio regular**

El ejercicio regular es beneficioso para la salud mental y física. Puedes intentar incorporar actividad física en tu rutina diaria, como:

1. Caminar durante 30 minutos al día.
2. Hacer yoga o tai chi para reducir el estrés y mejorar la flexibilidad.
3. Practicar deportes como el fútbol, el baloncesto o el tenis para liberar endorfinas y mejorar la salud mental.

Recuerda que el ejercicio no tiene que ser agotador. Puedes empezar con actividades ligeras y aumentar la intensidad a medida que te sientas más cómodo.

**Consejos adicionales**

1. **Come de manera consciente**: intenta comer sin distracciones, como la televisión o el teléfono. Nota el sabor, la textura y el aroma de la comida.
2. **Establece horarios de comida**: intenta comer en horarios regulares para evitar la ansiedad y el estrés relacionados con la comida.
3. **Busca apoyo**: habla con amigos, familiares o un profesional de la salud mental sobre tus sentimientos y experiencias.

Recuerda que la relación con la comida es única para cada persona, y lo que funciona para una persona puede no funcionar para otra. Lo importante es encontrar lo que funciona para ti y ser paciente contigo mismo.

¿Te gustaría explorar alguna de estas técnicas en más detalle o tienes alguna pregunta en particular?","{'rapport': 20.0, 'metamodelo': 0.0, 'anclaje': 0.0, 'reencuadre': 0.0, 'preguntas_poderosas': 0.0}","{'exploración': 12.5, 'profundización': 0.0, 'recomendación': 12.5, 'personalización': 16.666666666666664, 'tono cálido': 12.5, 'evita lenguaje clínico': 100.0, 'normaliza sentimientos': 28.57142857142857}",4.0,26.10544217687075
